{
  "schemaVersion": 1,
  "name": "hosted",
  "accountId": "374784ce2915a597adcecf9bcb2c5ee6",
  "prefix": "frockbot",
  "authPackage": "better-auth",
  "payments": "stripe",
  "workers": {
    "app": {
      "name": "frockbot-cloudflare",
      "hostnames": ["bot.frockbot.com"]
    },
    "computerHost": {},
    "appletBuild": {},
    "marketing": {
      "hostnames": ["frockbot.com", "www.frockbot.com"]
    },
    "adminPortal": {
      "name": "frockbot-admin-portal",
      "hostnames": ["admin.frockbot.com"]
    }
  },
  "d1DatabaseId": "f83c21a4-e5a0-4cc2-b0e1-636027b8c65e",
  "aiGateway": {
    "accountId": "374784ce2915a597adcecf9bcb2c5ee6",
    "id": "flock",
    "autoRoute": "flock-auto"
  },
  "nativeAuth": ["android", "macos", "macos-dev", "ios"],
  "nativeApps": {
    "android": [
      {
        "packageName": "com.frockbot.mobile",
        "sha256CertFingerprints": [
          "61:E6:47:9F:9C:57:55:15:4C:1F:93:9C:DE:48:E8:A7:57:EF:F3:13:6E:54:ED:1D:DA:5F:61:E7:8B:3C:1E:37"
        ]
      }
    ],
    "apple": ["Q444L76529.com.frockbot.mobile"]
  },
  "email": { "domain": "bots.frockbot.com" }
}
